{
  "version": "1.0.0",
  "releaseId": "golden-demo",
  "generatedAt": "2026-06-02T03:53:11.828621+00:00",
  "policyVersion": "1.0.0",
  "taxonomyVersion": "1.0.0",
  "decision": {
    "decision": "Block",
    "reasons": [
      "key_baseline_failed",
      "high_risk_not_closed_or_not_covered"
    ],
    "policyVersion": "1.0.0"
  },
  "riskPoints": [
    {
      "riskId": "R-SQL-001",
      "service": "order-service",
      "category": "SQLI",
      "severity": "P1",
      "status": "Open",
      "codeEvidence": [
        "OrderDao.java:8"
      ],
      "serviceLevelSummary": "Dynamic SQL concatenation in order lookup"
    },
    {
      "riskId": "R-AUTH-001",
      "service": "order-service",
      "category": "AUTH",
      "severity": "P1",
      "status": "Open",
      "codeEvidence": [
        "OrderController.java:17"
      ],
      "serviceLevelSummary": "Order API may lack authentication enforcement"
    }
  ],
  "middlewareCases": [
    {
      "caseId": "CASE-SQL-001",
      "baselineType": "sql-injection-baseline",
      "result": "FAIL",
      "targetService": "order-service",
      "execTime": "2026-05-29T10:00:00Z"
    },
    {
      "caseId": "CASE-SQL-ALL-001",
      "baselineType": "sql-injection-baseline",
      "result": "PASS",
      "targetService": "*",
      "execTime": "2026-05-29T10:00:00Z"
    },
    {
      "caseId": "CASE-CMD-001",
      "baselineType": "command-injection-baseline",
      "result": "SKIP",
      "targetService": "*",
      "execTime": "2026-05-29T10:00:00Z"
    },
    {
      "caseId": "CASE-FILE-001",
      "baselineType": "file-operation-baseline",
      "result": "PASS",
      "targetService": "*",
      "execTime": "2026-05-29T10:00:00Z"
    },
    {
      "caseId": "CASE-AUTH-001",
      "baselineType": "auth-baseline",
      "result": "PASS",
      "targetService": "*",
      "execTime": "2026-05-29T10:00:00Z"
    }
  ],
  "mappings": [
    {
      "riskId": "R-SQL-001",
      "caseId": "CASE-SQL-001",
      "coverageState": "Partial",
      "coverageScope": "serviceVerified",
      "confidence": 0.9,
      "explanation": "Service-specific SQL case FAIL takes precedence over wildcard SQL coverage"
    },
    {
      "riskId": "R-AUTH-001",
      "caseId": "CASE-AUTH-001",
      "coverageState": "Covered",
      "coverageScope": "serviceInferred",
      "confidence": 0.85,
      "explanation": "Auth baseline covered by wildcard middleware case (targetService=*)"
    }
  ],
  "gaps": [
    {
      "riskId": "R-SQL-001",
      "service": "order-service",
      "category": "SQLI",
      "gapType": "CaseFailed",
      "caseId": "CASE-SQL-001",
      "suggestion": "Remediate SQL injection pattern and re-run middleware case"
    }
  ],
  "agentRunTrace": [
    {
      "runId": "golden-demo",
      "agentType": "init",
      "inputHash": "golden",
      "outputHash": "aa6a3a06a8d5d113f35a7c2b834a0181f3f22caf0fa7b757c1aab45bed9a91c9",
      "artifactPath": ".claude/runs/golden-demo/manifest.json",
      "latencyMs": 0,
      "retryCount": 0
    },
    {
      "runId": "golden-demo",
      "agentType": "slices",
      "inputHash": "golden",
      "outputHash": "9e06f1d7ada3273f9e9745d634d354090df16ec28136b4fdad59deee35d4871a",
      "artifactPath": ".claude/runs/golden-demo/00-service-slices.json",
      "latencyMs": 0,
      "retryCount": 0
    },
    {
      "runId": "golden-demo",
      "agentType": "context",
      "inputHash": "golden",
      "outputHash": "d81b3015eba75363f61f847a9f62bd1544dda11da6b8fa8f63eee1c76f36fe7a",
      "artifactPath": ".claude/runs/golden-demo/01-context/order-service.json",
      "latencyMs": 0,
      "retryCount": 0
    },
    {
      "runId": "golden-demo",
      "agentType": "applicability",
      "inputHash": "golden",
      "outputHash": "951d2e7f475f9c268e1a0c73f93a2dd31da5314fbb2d8b2c3cbbdaa7ff31ddcd",
      "artifactPath": ".claude/runs/golden-demo/02-applicability/order-service.json",
      "latencyMs": 0,
      "retryCount": 0
    },
    {
      "runId": "golden-demo",
      "agentType": "signals",
      "inputHash": "golden",
      "outputHash": "72200642413f306fbb4e5c34de03594e86921d3db9f6b80f18ee9688015c93d9",
      "artifactPath": ".claude/runs/golden-demo/03-signals/order-service/dataflow.json",
      "latencyMs": 0,
      "retryCount": 0
    },
    {
      "runId": "golden-demo",
      "agentType": "profile",
      "inputHash": "golden",
      "outputHash": "3d11dbca941c380f37022b1d1f353f43ad6de379ae3bf0161784535a1263deb6",
      "artifactPath": ".claude/runs/golden-demo/04-profiles/order-service.json",
      "latencyMs": 0,
      "retryCount": 0
    },
    {
      "runId": "golden-demo",
      "agentType": "mappings",
      "inputHash": "golden",
      "outputHash": "8924d4dba64130e59610fda1f6065e6c599ae0fbf1672e531c2c88003c8cee85",
      "artifactPath": ".claude/runs/golden-demo/06-mappings.json",
      "latencyMs": 0,
      "retryCount": 0
    },
    {
      "runId": "golden-demo",
      "agentType": "decision",
      "inputHash": "golden",
      "outputHash": "9173b7bbe22bd1e5be7c0b77852d7ed1a3fc2e18e19cc19a6060f5b4b8d58052",
      "artifactPath": ".claude/runs/golden-demo/08-decision.json",
      "latencyMs": 0,
      "retryCount": 0
    }
  ]
}
